{"$schema":"https://json-schema.org/draft/2020-12/schema","type":"object","required":["fixture_version","status","cases"],"properties":{"fixture_version":{"type":"string"},"status":{"type":"string"},"contract":{"type":"string"},"comparison":{"type":"string"},"cases":{"type":"array","minItems":1,"items":{"type":"object","properties":{"id":{"type":"string","minLength":1},"operation":{"type":"string","minLength":1},"mode":{"enum":["exact","exact_draw_tape","exact_and_native_replay","statistical"]},"input":{"type":"object"},"expected":{"type":"object"},"note":{"type":"string"}},"required":["id","operation","mode","input","expected","note"],"additionalProperties":false}}},"additionalProperties":false}
