{"fixture_version":"1.0.0-draft.1","status":"proposed_not_current_engine_certification","contract":"04_CANONICAL_DOMAIN_CONTRACT.md","comparison":"operation-level expected-field projection plus independent schema/invariant checks","cases":[{"id":"money-max","operation":"parse_cents","mode":"exact","input":{"value":"9223372036854775807"},"expected":{"cents":"9223372036854775807"},"note":""},{"id":"money-min-excluded","operation":"parse_cents","mode":"exact","input":{"value":"-9223372036854775808"},"expected":{"error":"MONEY_OVERFLOW"},"note":""},{"id":"money-js-boundary","operation":"parse_cents","mode":"exact","input":{"value":"9007199254740993"},"expected":{"cents":"9007199254740993"},"note":""},{"id":"money-boolean","operation":"parse_cents","mode":"exact","input":{"value":true},"expected":{"error":"INVALID_MONEY"},"note":""},{"id":"money-float","operation":"parse_cents","mode":"exact","input":{"value":1.5},"expected":{"error":"INVALID_MONEY"},"note":""},{"id":"money-negative-zero","operation":"parse_cents","mode":"exact","input":{"value":"-0"},"expected":{"error":"INVALID_MONEY"},"note":""},{"id":"money-exponent","operation":"parse_cents","mode":"exact","input":{"value":"1e3"},"expected":{"error":"INVALID_MONEY"},"note":""},{"id":"money-overflow-add","operation":"add_cents","mode":"exact","input":{"a":"9223372036854775807","b":"1"},"expected":{"error":"MONEY_OVERFLOW"},"note":""},{"id":"income-negative","operation":"validate_sign","mode":"exact","input":{"kind":"income","amount_cents":"-1"},"expected":{"error":"INVALID_SIGN"},"note":""},{"id":"expense-positive","operation":"validate_sign","mode":"exact","input":{"kind":"expense","amount_cents":"1"},"expected":{"error":"INVALID_SIGN"},"note":""},{"id":"expense-zero","operation":"validate_sign","mode":"exact","input":{"kind":"expense","amount_cents":"0"},"expected":{"error":"INVALID_SIGN"},"note":""},{"id":"percent-half-up","operation":"scale_basis_points","mode":"exact","input":{"amount_cents":"101","variation_bps":-100},"expected":{"amount_cents":"100"},"note":""},{"id":"dollar-rounding-explicit","operation":"parse_dollars","mode":"exact","input":{"value":"1.005","rounding":"half_up"},"expected":{"cents":"101"},"note":""},{"id":"dollar-no-silent-rounding","operation":"parse_dollars","mode":"exact","input":{"value":"1.005","rounding":"reject_extra_precision"},"expected":{"error":"INVALID_MONEY"},"note":""},{"id":"weekly","operation":"recurrence","mode":"exact","input":{"kind":"weekly","anchor_date":"2026-01-01","start":"2026-01-01","end_exclusive":"2026-01-23"},"expected":{"dates":["2026-01-01","2026-01-08","2026-01-15","2026-01-22"]},"note":""},{"id":"biweekly","operation":"recurrence","mode":"exact","input":{"kind":"biweekly","anchor_date":"2026-01-01","start":"2026-01-01","end_exclusive":"2026-02-01"},"expected":{"dates":["2026-01-01","2026-01-15","2026-01-29"]},"note":""},{"id":"month-end-anchor","operation":"recurrence","mode":"exact","input":{"kind":"monthly","anchor_date":"2026-01-31","start":"2026-01-01","end_exclusive":"2026-04-01","month_day":31},"expected":{"dates":["2026-01-31","2026-02-28","2026-03-31"]},"note":""},{"id":"leap-month","operation":"recurrence","mode":"exact","input":{"kind":"monthly","anchor_date":"2024-01-31","start":"2024-02-01","end_exclusive":"2024-04-01","month_day":31},"expected":{"dates":["2024-02-29","2024-03-31"]},"note":""},{"id":"quarterly","operation":"recurrence","mode":"exact","input":{"kind":"quarterly","anchor_date":"2026-01-31","start":"2026-01-01","end_exclusive":"2027-01-01","month_day":31},"expected":{"dates":["2026-01-31","2026-04-30","2026-07-31","2026-10-31"]},"note":""},{"id":"annual-leap-recovery","operation":"recurrence","mode":"exact","input":{"kind":"yearly","anchor_date":"2024-02-29","start":"2024-01-01","end_exclusive":"2029-01-01"},"expected":{"dates":["2024-02-29","2025-02-28","2026-02-28","2027-02-28","2028-02-29"]},"note":""},{"id":"semi-1-15","operation":"recurrence","mode":"exact","input":{"kind":"semimonthly","anchor_date":"2026-01-01","start":"2026-02-01","end_exclusive":"2026-03-01","semimonthly_days":[1,15]},"expected":{"dates":["2026-02-01","2026-02-15"]},"note":""},{"id":"semi-15-eom","operation":"recurrence","mode":"exact","input":{"kind":"semimonthly","anchor_date":"2026-01-15","start":"2026-02-01","end_exclusive":"2026-03-01","semimonthly_days":[15,"EOM"]},"expected":{"dates":["2026-02-15","2026-02-28"]},"note":""},{"id":"one-time-included","operation":"recurrence","mode":"exact","input":{"kind":"once","anchor_date":"2026-09-29","start":"2026-09-29","end_exclusive":"2026-09-30"},"expected":{"dates":["2026-09-29"]},"note":""},{"id":"one-time-exclusive-end","operation":"recurrence","mode":"exact","input":{"kind":"once","anchor_date":"2026-09-30","start":"2026-09-29","end_exclusive":"2026-09-30"},"expected":{"dates":[]},"note":""},{"id":"invalid-leap-day","operation":"parse_date","mode":"exact","input":{"date":"2025-02-29"},"expected":{"error":"INVALID_DATE"},"note":""},{"id":"past-due-bill","operation":"project_occurrence","mode":"exact","input":{"as_of":"2026-09-29","end_exclusive":"2026-10-03","id":"00000000-0000-4000-8000-000000000010","nominal_date":"2026-09-28","state":"open","amount_cents":"5000"},"expected":{"events":[{"occurrence_id":"00000000-0000-4000-8000-000000000010","date":"2026-09-29","nominal_date":"2026-09-28","amount_cents":"-5000"}]},"note":""},{"id":"rescheduled-bill","operation":"project_occurrence","mode":"exact","input":{"as_of":"2026-09-29","end_exclusive":"2026-10-03","id":"00000000-0000-4000-8000-000000000010","nominal_date":"2026-09-30","rescheduled_date":"2026-10-02","state":"open","amount_cents":"5000"},"expected":{"events":[{"occurrence_id":"00000000-0000-4000-8000-000000000010","date":"2026-10-02","nominal_date":"2026-09-30","amount_cents":"-5000"}]},"note":""},{"id":"occurrence-paid","operation":"project_occurrence","mode":"exact","input":{"as_of":"2026-09-29","end_exclusive":"2026-10-03","id":"00000000-0000-4000-8000-000000000010","nominal_date":"2026-09-30","state":"paid","amount_cents":"5000"},"expected":{"events":[]},"note":"payment_pending is already represented by its hold; paid/skipped are settled projection exclusions."},{"id":"occurrence-skipped","operation":"project_occurrence","mode":"exact","input":{"as_of":"2026-09-29","end_exclusive":"2026-10-03","id":"00000000-0000-4000-8000-000000000010","nominal_date":"2026-09-30","state":"skipped","amount_cents":"5000"},"expected":{"events":[]},"note":"payment_pending is already represented by its hold; paid/skipped are settled projection exclusions."},{"id":"occurrence-payment_pending","operation":"project_occurrence","mode":"exact","input":{"as_of":"2026-09-29","end_exclusive":"2026-10-03","id":"00000000-0000-4000-8000-000000000010","nominal_date":"2026-09-30","state":"payment_pending","amount_cents":"5000"},"expected":{"events":[]},"note":"payment_pending is already represented by its hold; paid/skipped are settled projection exclusions."},{"id":"legacy-paid-no-link","operation":"migrate_occurrence","mode":"exact","input":{"paid":true,"transaction_id":null},"expected":{"state":"legacy_settled_unknown","new_transactions":[]},"note":""},{"id":"overdue-income-unconfirmed","operation":"project_income","mode":"exact","input":{"as_of":"2026-09-29","nominal_date":"2026-09-28","amount_cents":"20000","received":false,"expected_date_override":null},"expected":{"credited_today_cents":"0","warning":"OVERDUE_INCOME_UNCONFIRMED"},"note":""},{"id":"multiple-income-same-name","operation":"receive_incomes","mode":"exact","input":{"sources":[{"id":"00000000-0000-4000-8000-000000000011","name":"Work","amount_cents":"10000"},{"id":"00000000-0000-4000-8000-000000000012","name":"Work","amount_cents":"20000"}],"date":"2026-09-30","repeat_same_operations":true},"expected":{"posted_income_cents":"30000","transaction_count":2},"note":""},{"id":"expected-override-one-only","operation":"project_income_sequence","mode":"exact","input":{"base_cents":"20000","dates":["2026-09-30","2026-10-14"],"overrides":{"2026-09-30":"15000"}},"expected":{"amounts_cents":["15000","20000"]},"note":""},{"id":"same-day-debit-first","operation":"reduce_events","mode":"exact","input":{"opening_cents":"10000","as_of":"2026-09-29","events":[{"date":"2026-09-30","kind":"income","amount_cents":"20000"},{"date":"2026-09-30","kind":"bill","amount_cents":"-15000"}],"reserve_cents":"0"},"expected":{"minimum_cents":"-5000","ending_cents":"15000","headroom_cents":"0","shortfall_cents":"5000","first_negative_date":"2026-09-30"},"note":""},{"id":"opening-negative-no-events","operation":"reduce_events","mode":"exact","input":{"opening_cents":"-100","as_of":"2026-09-29","events":[],"reserve_cents":"0"},"expected":{"minimum_cents":"-100","ending_cents":"-100","headroom_cents":"0","shortfall_cents":"100","first_negative_date":"2026-09-29"},"note":""},{"id":"pending-holds","operation":"available_balance","mode":"exact","input":{"posted_cents":"10000","pending":[{"amount_cents":"-3000"},{"amount_cents":"9000"}]},"expected":{"available_cents":"7000","pending_inflow_spendable_cents":"0"},"note":""},{"id":"pending-to-posted","operation":"post_pending","mode":"exact","input":{"posted_cents":"10000","pending_amount_cents":"-3000","repeat_operation":true},"expected":{"posted_cents":"7000","hold_cents":"0","available_cents":"7000","posted_movement_count":1},"note":""},{"id":"pending-bill-no-double-charge","operation":"forecast_pending_bill","mode":"exact","input":{"posted_cents":"10000","hold_cents":"3000","bill_cents":"3000","same_occurrence":true},"expected":{"available_opening_cents":"7000","additional_bill_debit_cents":"0","minimum_cents":"7000"},"note":""},{"id":"multi-account-not-pooled","operation":"account_forecast","mode":"exact","input":{"balances":{"checking":"1000","savings":"100000"},"events":[{"account":"checking","amount_cents":"-2000"}],"scope":"checking"},"expected":{"minimum_cents":"-1000","shortfall_cents":"1000"},"note":""},{"id":"credit-purchase","operatio